{
  "version": "2.0",
  "project": {
    "name": "sample",
    "description": "",
    "languages_overall": [
      "markdown",
      "typescript"
    ],
    "frameworks_overall": [],
    "analyzed_at": "2026-05-27T15:25:12.456Z"
  },
  "repos": [
    {
      "id": "sample",
      "path": "../../sample-repo",
      "git_remote": "",
      "git_commit_hash": "unknown",
      "languages": [
        "markdown",
        "typescript"
      ],
      "frameworks": [],
      "primary_language": "markdown",
      "description": "v2.0 sample single-repo workspace"
    }
  ],
  "cross_edges": [],
  "capabilities": [],
  "architecture_decisions": [],
  "change_requests": [
    {
      "id": "CR-2026-999",
      "title": "CR-2026-999",
      "status": "draft",
      "date": "2026-05-27",
      "impact_node_ids": [
        "sample::file-src-app-ts",
        "sample::func-src-app-ts-answer",
        "sample::doc-README-md"
      ],
      "introduced_adrs": [],
      "dir_path": "change-requests/CR-2026-999-sample"
    }
  ],
  "traceability": [
    {
      "from": {
        "type": "requirement",
        "id": "REQ-001"
      },
      "to": {
        "type": "graph_node",
        "id": "sample::file-src-app-ts"
      },
      "relation": "may_affect",
      "confidence": "high",
      "cr_id": "CR-2026-999"
    },
    {
      "from": {
        "type": "requirement",
        "id": "REQ-001"
      },
      "to": {
        "type": "graph_node",
        "id": "sample::func-src-app-ts-answer"
      },
      "relation": "may_affect",
      "confidence": "high",
      "cr_id": "CR-2026-999"
    },
    {
      "from": {
        "type": "requirement",
        "id": "REQ-001"
      },
      "to": {
        "type": "graph_node",
        "id": "sample::doc-README-md"
      },
      "relation": "may_affect",
      "confidence": "high",
      "cr_id": "CR-2026-999"
    }
  ],
  "quality_attributes": [],
  "risks": [],
  "technical_debt": [],
  "known_unknowns": []
}
